,screen_name,description,is_science,is_farmer,is_political,is_business,is_media,is_training,is_nonprofit,is_food,is_medical,is_internationalagency,is_nature,is_other,NOTES
1,narendramodi,Prime Minister of India,,,1,,,,,,,,,,
2,Pontifex,Welcome to the official Twitter page of His Holiness Pope Francis,,,,,,,,,,,,1,
3,SenFranken,Former U.S. Senator Al Franken of Minnesota.,,,1,,,,,,,,,,
4,Ra_THORe,"Member of Parliament - Jaipur (Rural), Olympic 🥈 Medalist, Padma Shri, Army 🇮🇳",,,1,,,,,,,,,,
5,SenatorHeitkamp,"The archived tweets of Heidi Heitkamp, former U.S. Senator for #NorthDakota. This is an inactive account.",,,1,,,,,,,,,,
6,PMOIndia,Office of the Prime Minister of India,,,1,,,,,,,,,,
7,HRajaBJP,"Official Twitter Account of Shri.H Raja, National Secretary, Bharatiya Janata Party. Ex-MLA from Karaikudi Assembly Constituency, Tamil Nadu.",,,1,,,,,,,,,,
8,universal_sci,Official Universal-Sci twitter account - Providing you with Interesting news stories about world wide scientific endeavours,,,,,1,,,,,,,,
9,MVenkaiahNaidu,Vice President of India,,,1,,,,,,,,,,
10,kishanreddybjp,"Union Minister of State for Home Affairs, Govt. of India.            Member of Parliament - Secunderabad (Telangana).",,,1,,,,,,,,,,
11,BJP4India,"Official Twitter account of the Bharatiya Janata Party (BJP), world's largest political party. भारतीय जनता पार्टी (भाजपा)

https://t.co/d1IYtw5taF",,,1,,,,,,,,,,
12,narendramodi_in,Twitter account of https://t.co/zzYhUTXOHI – Shri Narendra Modi's personal website & the Narendra Modi Mobile App.,,,1,,,,,,,,,,UNOFFICIAL ACCOUNT?
13,ashokgehlot51,Chief Minister of Rajasthan,,,1,,,,,,,,,,
14,SadhguruJV,"A Yogi, Mystic & Visionary. This account is managed by volunteers @Ishafoundation. Tweets from Sadhguru himself are signed - Sg",,,,,,,,,,,,,
15,rsprasad,"Law & Justice, Communications, Electronics & Information Technology Minister of India #DigitalIndia",,,1,,,,,,,,,,
16,qikipedia,Quite Interesting facts from the team behind the BBC TV show QI. https://t.co/KajPX02jPd https://t.co/e7kKHcHU2N https://t.co/q3qVciWTD7,,,,,1,,,,,,,,
17,Hugh_Cassidy,"Tweeting about garden colour, all iPhone photos, #DahliaLove #GardenLove #HugosNewGarden #MidWinterJoy #PotagerLove Support people with abilities",,,,,,,,,,,,,"Home gardener- post pictures of his garden, some of which includes 'food' but doen't quit fit into the food category. Leaving this blank for now unless we decide on a new 'gardener category or something."
18,PTI_News,PTI !  We bring the World to you...,,,,,1,,,,,,,,
19,manojsinhabjp,,,,1,,,,,,,,,,
20,RepTimWalz,"Teacher, Football Coach, Command Sgt. Major; Former Representative of Minnesota’s 1st Congressional District",,,`,,,,,,,,,,
21,theumalista,Everything about the home and the best tasting food you have ever seen.,,,,,,,,1,,,,,
22,Manekagandhibjp,"Member of Parliament - Sultanpur Lok Sabha Constituency. 
Follow me on Facebook: https://t.co/L9yr0C3zBl…",,,1,,,,,,,,,,
23,bhargav_gopal,"MLA & Ex Cabinet Minister (Panchayat & Rural Development, Social Justice) Madhya Pradesh",,,1,,,,,,,,,,
24,karaedwards,"I’m a Voice Actor and Mom. Goten, Videl in #DragonBallZ, #DragonBallSuper, Bubble Girl in #MyHero, Athena in #Smite, Chihiro in #Dangonrompa, #Battleborn...",,,,,,,,,,,,,
25,naralokesh,"MLC | General Secretary, Telugu Desam Party | Stanford MBA",,,1,,,,,,,,,,
26,DanBarber,The Third Plate {@PenguinPress} ; Instagram: @chefdanbarber @row7seeds,,,,,,,,1,,,,,
27,5Forty3,"Founder & CEO 5Forty3 Datalabs.
A story teller who weaves tales through numbers and a demographic scientist who has indigenously built many data-tech platforms",1,,,,,,,,,,,,
28,PM_Narendermodi,"PM shri Narendra Modi FC Account

#Narendra #Modi #PM #NadendraModi #Modi #NarederModi #Narender #modi #PMmodi #narendramodi #narendra #modi #PGP #INDIA🇮🇳🇮🇳",,,1,,,,,,,,,,UNOFFICIAL ACCOUNT?
29,PonnaarrBJP,"Ex.Union Minister of State for Finance and Shipping, Government of India. Ex.Member of Parliament from Kanniyakumari Lok Sabha Constituency.",,,1,,,,,,,,,,
30,ishafoundation,"Isha Foundation is a non-religious, non-profit, public service organization, which addresses all aspects of human wellbeing through Yoga & Outreach programs.",,,,,,,1,,,,,,
31,jayantsinha,"BJP Member of Parliament - Hazaribagh. Former venture capitalist; passionate about India, technology, tennis & cricket.",,,1,,,,,,,,,,
32,RadhamohanBJP,"Member of Parliament, Lok Sabha, Purvi Champaran, Bihar. Former Union Minister of Agriculture & Farmers' Welfare, GoI.",,,1,,,,,,,,,,
33,PRupala,"Union Minister of the State - Agriculture & Farmers' Welfare - Govt. of India, Member of Parliament (Rajya Sabha)",NA,1,1,,,,,,,,,,
34,CMOMaharashtra,Office of the Chief Minister of Maharashtra @Dev_Fadnavis,,,1,,,,,,,,,,
35,iManishBJP,"President Of BJYM,Karnavati Mahanagar",,,1,,,,,,,,,,
36,bjparvind,"MLA Mahadevapura Constituency, Frmr Health Minister, Frmr Higher Edu Minister, GoK. General Secretary - BJP Karnataka",,,1,,,,,,,,,,
37,RishiMishra_,Right of Centre | Student | Interested in Indian Politics | International relations I Blessed by PM and HM | RT's Not Endorsement.,,,,,,,,,,,,,
38,ShainaNC,"Fashion designer.Treasurer, BJP Maharashtra. Spokesperson, BJP. Popularly known as the Queen of Drapes for draping the saree in 54 styles & in the fastest time.",,,1,,,,,,,,,,
39,EamonRyan,Leader of the Green Party / Comhaontas Glás  https://t.co/cFwxeRMaWe / https://t.co/h4PMVLN6ww,,,1,,,,,,,,,,
40,herdyshepherd1,Lake District. Shepherd. Herdwicks. Belted Galloways. Sheepdogs. Nature-friendly farming. Writer. Trying to be quiet. Back soon.,,1,,,1,,,,,,,,
41,Punjab13to18,Archives of the Punjab Government: 2013 to 2018,,,1,,,,,,,,,,
42,Oscarthefarmer,"Mixed beef cattle/cropping farmer, continuing family tradition on this land since 1872.

Agriculture, Environment rants and cynicism likely.",,1,,,,,,,,,,,
43,RenukaJain6,"FCA, CS. Financial & Tax Advisor, Portfolio Management. favorite moments Sky diving in Munich & Bungy in Cairns. Blessed to be followed by respected PM 🙏",,,,,,,,,,,,,
44,BJP4Bengal,Official Twitter handle of BJP West Bengal (BJPBengal),,,1,,,,,,,,,,
45,Stanford,Stanford is one of the world's leading research and teaching institutions. Official Twitter feed by University Communications.,1,,,,,,,,,,,,
46,BhupendraSinh1,"Cabinet Minister of Education, Higher & Technical Education, Law & Justice, Legislative & Parliamentary Affairs, Salt Industry, Cow Breeding and Civil Aviation.",,,1,,,,,,,,,,
47,VdsrBjpit,வேடசந்தூர் தொகுதி பா.ஜ.க தகவல் தொழில்நுட்ப பிரிவு,,,1,,,,,,,,,,
48,BKRichey,Golf Course Superintendent - Lake Nona Golf and Country Club,,,,,,,,,,,,,
49,PMuralidharRao,"National General Secretary, BJP. Working towards Empowering India & uplifting the poor.",,,1,,,,,,,,,,
50,ANI,"Asian News International.Multi-media news agency,content for information platforms:TV,Internet,broadband,newspapers,mobiles https://t.co/8qaMJ9LH",,,,,1,,,,,,,,
51,jhaprabhatbjp,| Nationalist | BJP Karyakarta | Rajya Sabha MP | National Vice President BJP | Incharge BJP Punjab | Incharge BJP Chandigarh,,,,,,,,,,,,,
52,CimGOI,"Official Account of the Office of Minister of Commerce and Industry, Government of India",,,1,,,,,,,,,,
53,JAINAM_2017,"जब भी मैं बुरे हालातो से घबराता हूँ,
तब मेरे महादेव की आवाज आती है, रूक मैं अभी आता हूँ ।
🙏🙏 
हर हर महादेव  🙏🙏🙏",,,,,,,,,,,,1,no clear affiliation 
54,SuPriyoBabul,"HumanByNature😀SingerByHeart🥳ExBanker💰MoS Environment,Forest & Climate Change• GovtOfINDIA•ThinSkinned-FindUnfairTrollingHard2Deal With•AmNotAlwaysRight🤩",,,1,,,,,,,,,,
55,DeanDjackson,"CIH ag machinery sales consultant for Stoltz Sales & Service, from lawnmowers to combines we have them all",,,,1,,,,,,,,,
56,EdwinTaylor69,"South Northumerland Farmer, Dedicated no tiller and growing cover crops to improve soil health.",,1,,,,,,,,,,,
57,MaheishGirri,"राष्ट्रीय मंत्री, भाजपा | National Secretary, BJP | https://t.co/BAIxf9PcD2 | https://t.co/7Eeq5tp85K |",,,1,,,,,,,,,,
58,RepBost,"Member of Congress proudly representing IL-12. Serving on @TransportGOP, @HouseAgGOP, and @HouseVetAffairs Committees. Find me on FB at https://t.co/cjWY9Itiyr",,,1,,,,,,,,,,
59,bug_gwen,I'm a bug AND a feature! I do insect education & write about science. Founder of @ento_allies. Tweets personal/do not represent employers etc 🐝 she/her/PhD,,,,,1,,,,,,,,
60,getfiscal,Co-host of @youcantwinpod •,,,,,,,,,,,,1,"his tweet that we picked up was about Bernie Sanders being old and, if elected, only being able to promote 'soil quality'"
61,RathWayne,"Golf Course Superintendent - Aurora, Ontario",,,,1,,,,,,,,,
62,BJPLive,The Internet TV initiative by the BJP.,,,1,,1,,,,,,,,
63,UNEnvironment,Official account of the United Nations Environment Programme. 🌏🌍🌎,,,,,,,,,,1,,,
64,DaniNierenberg,"@FoodTank co-founder & President. Host of the ""Food Talk with Dani Nierenberg"" podcast (LINK BELOW). Insta: @FoodTank.",,,,,,,1,1,,,,,
65,Bovidiva,Livestock sustainability consultant. Animal scientist. Breast cancer patient. Mum. 2018 Farmers Guardian Farming Hero. Dairy Industry Woman of the Year 2017.,1,,,,,1,,,,,,,
66,KailashOnline,"National General Secretary of #BJP, Active Worker & a Proud Indian who continuously strives for development.",,,1,,,,,,,,,,
67,doctorsensation,"medical doctor,biohacker. plantbased ketogenic nutrition. Wimhofmethod instructor. Co-producer“Bought”the movie",1,,,,,,,,,,,,
68,AhlawatMp,"EX-Member of Parliament(Lok Sabha) from Jhunjhunu, Rajasthan, India",,,1,,,,,,,,,,
69,nheptulla,"Governor of Manipur, Former Union Minister of Minority Affairs, Honorary Life President of IPU, Former Deputy Chairman Rajya Sabha",,,1,,,,,,,,,,
70,sunitanar,"Editor, Down To Earth and Director, CSE, Environmentalist",,,,,1,,,,,,,,
71,RobMitchellMLA,MLA for Charlottetown - Winsloe & Leader of the Prince Edward Island Liberal Party,,,1,,,,,,,,,,
72,namelus_,"In hindsight, my search for an anagram of my name has left me namelus.",,,,,,,,,,,,,
73,raythesoilguy1,Soil Health Specialist: Teaching Agroecology principles and Biomimicry/Ecomimcry concepts to reduce man made inputs on soil ecosystems.,,,,,,1,,,,,,,
74,smouse_lillee,Organic gardener.I grow  almost everything.Plants and animals talk to me. Wild horse /animal advocate.Rattlesnake relocation specialist.,,1,,,,,,,,,,,
75,BJP4JnK,"Official Twitter Account of Bharatiya Janata Party, Jammu & Kashmir | Join BJP@ https://t.co/84RHmlpJTF",,,1,,,,,,,,,,
76,ONGC_,"Welcome to the official twitter handle of Oil and Natural Gas Corporation Limited (ONGC), one of the world's largest oil & gas exploration & production company",,,,1,,,,,,,,,
77,pid_gov,"The Official twitter account of Pakistan Government. Your very first stop for the very latest policy announcements, Information & News on Pakistan",,,1,,,,,,,,,,
78,n8doremus,"Farmer in east/central Nebraska, father of 3, husband to Amy, Channel Seedsman.",,1,,,,,,,,,,,
79,AnikaMolesworth,"Young Farmer of the Year, MSc Sustainable Ag & PhD international agricultural researcher. Passion for #agriculture #farming #climate #environment #renewables",1,1,,,,,,,,,,,
80,NamoApp,"Official App of PM of India, Narendra Modi. It brings to you latest information, instant updates & helps you contribute towards various tasks",,,1,,,,,,,,,,
81,CTRavi_BJP,"ಹೆಮ್ಮೆಯ ಕನ್ನಡಿಗ;
ಪ್ರಧಾನ ಕಾರ್ಯದರ್ಶಿ- ಬಿಜೆಪಿ ಕರ್ನಾಟಕ; ಶಾಸಕರು - ಚಿಕ್ಕಮಗಳೂರು.

Proud Kannadiga; General Secretary, BJP; 
MLA - Chikkamagaluru; Former Minister.",,,1,,,,,,,,,,
82,Ng_lab,"We work at the intersection of chemistry, biology and engineering, building models to investigate human-environment interactions.",1,,,,,,,,,,,,
83,CharCunningham,Townie turned agriculture enthusiast | 24 | Award-winning freelance agricultural journalist & PR assistant | Inconsistent blogger | All views my own...,,,,,1,,,,,,,,
84,USAIDAfghan,Thanks for visiting the #USAID #Afghanistan Twitter page. Find our privacy policy at https://t.co/wnwLDypbhU,,,1,,,,,,,1,,,
85,BJP4Jharkhand,Official twitter account of BJP Jharkhand. Follow us on facebook @BJP4Jharkhand,,,1,,,,,,,,,,
86,singshobhasing,#oshodhara acharya. #nature lover #ForestTherapy guide,,,,,,,,,,,1,,
87,PAllenSmith,"Advocate for all things natural. Lover of rich soil, food and old-school flocks. Redefining the iconic American farm. Sharing design, beauty and bounty.",,,,,,,,,,,1,,
88,japantimes_life,"Feature stories on life in Japan (style, travel, food, language, digital) from The Japan Times. 英字新聞・ジャパンタイムズが発信する、教育、グルメ、科学、メディア、トラベルなど、さまざまなジャンルの特集記事。",,,,,1,,,,,,,,
89,JonathanPembs,A lover of landscapes and the natural world. General Manager for the National Trust. Images and thoughts my own.,,,,,,,,,,,1,,
90,FructoseNo,'Ex-Silenced' Orthopaedic Surgeon advocating real food. Healthy Eating advocate #LCHF. Author - Inversion - One Man's Answer for World Peace and Global Health,,,,,1,,,1,1,,,,
91,mahesh10816,Patriotic Indian-Travel professional & Consultant-Always India First- Call a Spade a Spade. RTs not endorsements. Honoured to be followed by @narendramodi ji 🙏,,,,,,,,,,,,,
92,WildlifeTrusts,"Sharing nature stuff, stories & news from The Wildlife Trusts - our goal is nature's recovery on land and at sea. Tweets by TWT comms team.",,,,,,,1,,,,,,
93,rkmbelurmath,"The Official Twitter account of Ramakrishna Math and Ramakrishna Mission, Belur Math.",,,1,,,,,,,,,,
94,msswaminathan,"Official Twitter profile of Prof M S Swaminathan, agriculture scientist",1,,,,,,,,,,,,
95,MGigger,"Farmer, Teacher, Shenaniganizer. Mom to 4 geniuses. Wife to a Viking. #missbaconseeds. $hillin for BigAg, BigPharma, BigPapa. Ocean Front Property available.",,1,,,,,,,,,,,
96,LEMVet,"Scientist, ecologist | Director NIOO-KNAW, Prof. at WU | Sustainable innovation inspired by nature is my 3rd job | C2C|Circle economy https://t.co/u6Gh5Lqyep",1,,,,,,,,,,,,
97,sanjeevkumarbso,,,,1,,,,,,,,,,
98,DFarms001,Dave Delhotal...Strip-Tiller...Soil Health Advocate...Data Driven Farmer...Ag Farmacy Sales Consultant...and formally know as TheStripper,,1,,1,,,,,,,,,
99,will_brinton,Farming systems researcher. Founder of Woods End Soil Lab;  Inventor of @Solvitacarbon. My tweets are my own. - Diversity in Unity,1,1,,,,,,,,,,,
100,MMehlhaf,"@amyerin4020’s Fiancé, @PioneerSeeds Promoter, Certified Crop Adviser, Crop Consultant, Believer in the one true God",,,,1,,1,,,,,,,